title,deadline,country,estimated_value_eur,tender_url,notice_id,cpv_codes,description,buyer_name
Spain – Medical consumables,2026-01-30,ESP,,https://ted.europa.eu/en/notice/-/detail/14380-2026,14380-2026,33140000|33140000|33140000|33140000|33140000|33140000|33140000|33140000|33140000|33140000|33140000|33140000|33140000|33140000|33140000|33140000|33140000,"KIT CON PULSERA C/PINZA UMBILICAL CON ETIQUETAS IDENTIFICATIVAS PULSERAS IDENTIFICATIVAS DEL PACIENTE TUBO SILICONA ROLLO 15 M TUBO SILICONA ROLLO 25 M ADAPTADORES PARA ALIMENTACIÓN CONECTORES PARA CATÉTERES DE DRENAJE PUNZÓN PARA TRANSFERENCIA DE LÍQUIDOS FILTROS PARA PRUEBA FUNCIÓN PULMONAR CON PINZA NASAL Y BOQUILLA RÍGIDA PARA ESPIRÓMETRO JÄEGER FILTROS PARA PRUEBAS FUNCIÓN PULMONAR CON PINZA NASAL Y CON BOQUILLA FLEXIBLE PARA ESPIRÓMETRO JÄEGER FILTROS PARA PRUEBAS FUNCIÓN PULMONAR CON PINZA NASAL Y CON BOQUILLA FLEXIBLE PARA ESPIRÓMETRO MEDISOFT PINZA NASAL PARA ESPIROMETRÍA FILTRO PARA RECONSTITUCIÓN DE FÁRMACOS CON MEMBRANA DE 0,22 MICRAS Y DIÁMETRO DE 25MM FILTROS PARA RECONSTITUCIÓN DE FÁRMACOS CON MEMBRANA DE 0,45 Y 0,8 MICRAS Y DIÁMETRO DE 33 MM HUMIDIFICADOR CON AGUA ESTÉRIL PARA CAUDALÍMETRO CON ADAPTADOR DE 450-550ML. HUMIDIFICADOR CON AGUA ESTÉRIL PARA CAUDALÍMETRO CON ADAPTADOR DE 300-400ML. FILTROS PARA PRUEBAS DE FUNCIÓN PULMONAR CON BOQUILLA RÍGIDA PARA ESPIRÓMETRO COSMED",SERGAS. Servizo Galego de Saúde
Italy – Medical consumables,2026-02-20,ITA,,https://ted.europa.eu/en/notice/-/detail/14391-2026,14391-2026,33140000|33140000|33140000|33140000|33140000|33140000|33140000|33140000|33140000|33140000|33140000|33140000|33140000|33140000|33140000|33140000|33140000|33140000|33140000|33140000|33140000|33140000|33140000|33140000|33140000|33140000|33140000|33140000|33140000|33140000|33140000|33140000|33140000|33140000|33140000|33140000|33140000|33140000|33140000|33140000|33140000|33140000|33140000|33140000|33140000|33140000|33140000|33140000|33140000|33140000|33140000|33140000|33140000|33140000|33140000|33140000|33140000|33140000|33140000|33140000|33140000|33140000|33140000|33140000|33140000|33140000|33140000|33140000|33140000|33140000|33140000|33140000|33140000|33140000|33140000|33140000|33140000|33140000|33140000|33140000|33140000|33140000|33140000|33140000|33140000|33140000|33140000|33140000|33140000,"Bisturi circolare per biopsia cutanea - lotto composto (vd. Elenco) Cannule di aspirazione Yankauer in PVC con interruttore - lotto composto (vd. Elenco) Sistema di drenaggio a soffietto a media pressione - lotto composto (vd. Elenco) Sistema di aspirazione a circuito chiuso con tubo Redon - lotto singolo (vd. Elenco) Drenaggio piatto in silicone tipo Jackson-Pratt - lotto singolo (vd. Elenco) Drenaggio capillare con scanalature a spirale in silicone - lotto singolo (vd. Elenco) Tubi ad azione capillare tipo Penrose tubulare e piatto - lotto singolo (vd. Elenco) Catetere in PVC termosensibile preassemblato al trocar - lotto composto (vd. Elenco) Kit toracentesi/paracentesi - lotto composto (vd. Elenco) Sacca di raccolta di ricambio - lotto singolo (vd. Elenco) Salvietta detergente ad azione antimicrobica - lotto singolo (vd. Elenco) Detergenti e prodotti per macchine lavastrumenti - lotto composto (vd. Elenco) Fogarty biliari - lotto singolo (vd. Elenco) Elettrodi - lotto composto (vd. Elenco) Manipolo monouso sterile con comando manuale e bilancere impermeabile - lotto singolo (vd. Elenco) Manipolo elettrochirurgico per sistema a radiofrequenza a tre modalità - lotto singolo (vd. Elenco) Placche per elettrobisturi bipartite monouso - lotto composto (vd. Elenco) Piastra monouso per adulti con superficie dotata di adesivo conduttivo in hidrogel - lotto composto (vd. Elenco) Cavo per pinza monopolare per elettrobisturi Erbe - lotto composto (vd. Elenco) Cavo per pinza bipolare per elettrobisturi Erbe - lotto composto (vd. Elenco) Pinza bipolare cushing isolata per coagulazione - lotto singolo (vd. Elenco) Dispositivo di chiusura degli accessi laparoscopici tipo Carter-Thomason - lotto composto (vd. Elenco) Contenitore di sicurezza per il conteggio di aghi, lame e bisturi - lotto singolo (vd. Elenco) Soluzione salina nebulizzata (no gas) con aggiunta di ioni argento ad attività antibatterica - lotto singolo (vd. Elenco) Medicazione sterile, antisettica in granuli a base di cadexomero iodico - lotto singolo (vd. Elenco) Sensori bilaterale per BIS - lotto singolo (vd. Elenco) Siringa da 1 ml contenente destranomero di acido jaluronico - lotto singolo (vd. Elenco) Test di Bowie Dick, indicatori biologici, sistema per la tracciabilità, sistemi per la stampa, sigilli ed etichette - lotto composto (vd. Elenco) Filtri in PTFE pluriuso per container di sterilizzazione - lotto composto (vd. Elenco) Telini sterili ad azione battericida, iodati, per protezione della cute - lotto composto (vd. Elenco) Sistema di copertura per Tavolo Operatorio - lotto composto (vd. Elenco) Sistema di riscaldamento liquidi di lavaggio a temperatura controllata - lotto singolo (vd. Elenco) Tappeto decontaminante dotato di bio-adesivo - lotto composto (vd. Elenco) Sensori cutanei monopazienti per il monitoraggio in continuo e non invasivo della temperatura corporea - lotto singolo (vd. Elenco) Penne dermografiche - lotto composto (vd. Elenco) Soluzione sterile ed apirogena di sodio cloruro 0,9% da 500 ml per irrigazione e lavaggio - lotto singolo (vd. Elenco) Tappetino per l'assorbimento di liquidi ed essudati per sala operatoria - pretagliato - lotto singolo (vd. Elenco) Tappeto assorbente con superficie inferiore in plastica e parte superiore in materiale superassorbente - lotto singolo (vd. Elenco) Tamponi/Spugnette sterili con adesivo per la rimozione di impurità della lama del bisturi durante l'intervento - lotto singolo (vd. Elenco) Materassino per posizionamento paziente in Trendeleburg - lotto singolo (vd. Elenco) Sistema monouso sterile di terapia a pressione negativa - lotto composto (vd. Elenco) Sistema a pressione negativa per il trattamento di ferite difficili - lotto composto (vd. Elenco) Fogarty arteriosi per embolectomia - lotto singolo (vd. Elenco) Kit procedurale per il trattamento laser delle fistole - lotto composto (vd. Elenco) Schiuma detergente gelitificante i liquidi - lotto singolo (vd. Elenco) Set per la somministrazione intravescicale",ASP DI TRAPANI - U.O.C. PROVVEDITORATO
Spain – Medical consumables,2025-08-25,ESP,,https://ted.europa.eu/en/notice/-/detail/14401-2026,14401-2026,33140000|33140000|33140000|33140000|33140000|33140000|33140000|33140000|33140000,"Lote 1: Material quimico Lote 2: Material de laboratorio Lote 3: Material sanitario Lote 4: Anticuerpos y productos biotecnologicos Lote 5: Reactivos de Genética: Citogenética y biología molecular Lote 6: Reactivos de cultivo celular y de biología celular Lote 7: Reactivos de inmunodetección, cromatografía Lote 8: Material para cuidado de animalario",Fundación para la Investigación Biomédica del Hospital Gregorio Marañón
Sweden – Furniture,2026-02-09,SWE,,https://ted.europa.eu/en/notice/-/detail/14489-2026,14489-2026,39100000|31500000|33192000|39000000|39110000|39130000|39134000|39140000|39141000|39143000|39143100|39143120|39143200|39143300|39150000|39151000|39151300|39153000|39155000|39156000|39160000|39161000|39200000|39290000|39500000|39515000|39515100|39515110|39515400|39515420|39100000|39161000|39160000|33192000|39130000|39100000|39500000|39130000|39140000|31500000|33192000|39000000|39110000|39130000|39134000|39140000|39141000|39143000|39143100|39143120|39143200|39143300|39150000|39151000|39151300|39153000|39155000|39156000|39160000|39161000|39200000|39290000|39500000|39515000|39515100|39515110|39515400|39515420|39000000|39100000|39130000|39141000|39143000|39143100|39143120|39143200|39143300|39150000|39151000|39151300|39153000|39155000|39156000|39160000|39100000|39130000|39134000|39143200|39150000|39151000|39151300|39153000|39155000|39156000|39161000|39100000|39130000|39134000|39140000|39143200|39143300|39150000|39151000|39151300|39153000|39156000|39100000|39134000|39140000|39143200|39150000|39151000|39151300|39153000|39155000|39156000|39130000|39134000|39140000|39143200|39143300|39150000|39151000|39151300|39153000|39155000|39156000|39515000|39515100|39515110|39515300|39515400|39515420|39110000|39111100|39112000|39113000|39113500|39134000|39153000|39141000|39143000|39143100|39143120|39143200|39143300|39150000|39151000|39151300,"Dessa krav ska besvaras och uppfyllas av samtliga anbudsgivare Krav som ska besvaras och uppfyllas av anbudsgivare som lämnar anbud för anbudsområde förskola, upp till 6 år A1- A9. Krav som ska besvaras och uppfyllas av anbudsgivare som lämnar anbud för anbudsområde skola, från 6 år B1-B9. Krav som ska besvaras och uppfyllas av anbudsgivare som lämnar anbud för anbudsområde skola C1- C9. Krav som ska besvaras och uppfyllas av anbudsgivare som lämnar anbud för anbudsområde kontor och förvaring D1-D9. Krav som ska besvaras och uppfyllas av anbudsgivare som lämnar anbud för anbudsområde lobby och gemensamma ytor E1-E9. Krav som ska besvaras och uppfyllas av anbudsgivare som lämnar anbud för anbudsområde hängande textilier och solskydd inomhus F1-F9. Krav som ska besvaras och uppfyllas av anbudsgivare som lämnar anbud för anbudsområde arbetsstolar G1-G9. Krav som ska besvaras och uppfyllas av anbudsgivare som lämnar anbud för anbudsområde Boende H1-H9.",Adda Inköpscentral AB
"Norway – Sterilisation, disinfection and hygiene devices",,NOR,,https://ted.europa.eu/en/notice/-/detail/14558-2026,14558-2026,33191000|33100000|33168000|33168100|33191100|33192000|33191000|33100000|33168000|33168100|33191100|33192000,"Requirement specifications for hearing: The South Eastern Norway Regional Health Authority (Helse Sør-Øst RHF) project organisation plans to procure equipment for re-processing and storage of flexible endoscopes for the Nye Aker and Nye Rikshospitalet. The competition is planned to be implemented in the summer 2026. We would like feedback from the market on the requirements in annex C2U requirement specifications for equipment for re-processing flexible endoscopes, so that good competition and efficient execution are ensured. We would like suppliers to look at and provide input on the content of the requirements. Especially if the requirements exclude the competition, cannot be implemented, or are not relevant for this competition. See the accompanying documents for more information.",Helse Sør-Øst RHF
"Italy – Echo, ultrasound and doppler imaging equipment",2026-02-18,ITA,,https://ted.europa.eu/en/notice/-/detail/14691-2026,14691-2026,33112000|33112000|33112000,Ecotomografo U.O.C. Diagnostica per Immagini del P.O. di Taormina Ecotomografo U.O.S.D. del P.O. di Patti,Azienda Sanitaria Provinciale di Messina - Ufficio Provveditorato
Germany – Laboratory pipettes and accessories,2026-01-16,DEU,,https://ted.europa.eu/en/notice/-/detail/14941-2026,14941-2026,38437000|33140000|33141310|33790000|39225700|39225710|39225720|39225730|39226000|44618350|38437000|33790000|38437000|38437000|38437000|33140000|33141310|33790000|39225700|39225710|39225720|39225730|39226000|44618350|39225700|39225710|39225720|39225730|39226000|44618350|33140000|33141310|33790000|39225700|39225710|39225720|39225730|39226000|44618350|33140000|33141310|33790000|39225700|39225710|39225720|39225730|39226000|44618350|33140000|33141310|33790000|39225700|39225710|39225720|39225730|39226000|44618350,"Pipetten und Pipettenspitzen Flaschen inkl. Verschlüsse, Kolben, Gläser Verschiedene Kunststoffartikel Verschiedene Glas- und Kunststoffartikel des Herstellers Macherey-Nagel Verschiedene Glas- und Kunststoffartikel des Herstellers Sarstedt",Bayerisches Landesamt für Gesundheit und Lebensmittelsicherheit - Z3
Poland – Pharmaceutical products,2026-01-22,POL,,https://ted.europa.eu/en/notice/-/detail/14965-2026,14965-2026,33600000|33140000|33600000|33600000|33600000|33600000|33600000|33600000|33600000|33600000|33600000|33600000|33600000|33600000|33600000|33600000|33600000|33600000|33600000|33600000|33600000|33600000|33600000|33600000|33600000|33600000|33140000|33140000|33140000|33140000|33140000|33140000,"1. Leki różne – 11 pozycji w Części 2. Szczegółowy opis przedmiotu zamówienia, wymagania Zamawiającego określono w Formularzu cenowo – ofertowym – Załączniku nr 1 do SWZ. 3. Zakres zamówienia obejmuje dostawę przedmiotów zamówienia w ilościach wyszczególnionych w Formularzach cenowo – ofertowych na okres: - Część nr 1 – 24 miesięcy 4. Zamawiający nie dopuszcza składania ofert równoważnych. 5. TERMIN WYKONANIA ZAMÓWIENIA: 5.1 Zakup i sukcesywna dostawa przedmiotów zamówienia: Część nr 1 - przez 24 miesiące, licząc od dnia 12.03.2026r. 5.2 W Części nr 1 Zamawiający dopuszcza możliwość wcześniejszego realizowania zakupów w przypadku wyczerpania ilości z aktualnej umowy. W takim przypadku termin realizacji umowy, liczony będzie od momentu pierwszego zakupu danego przedmiotu zamówienia. 5.3 Zamawiający w Części nr 1 dopuszcza możliwość późniejszego rozpoczęcia realizacji umowy, w przypadku przedłużenia się procedury przetargowej. 5.4 Zamawiający w Części nr 1 dopuszcza możliwość zmiany terminu obowiązywania umowy zawartej z Wykonawcą w przypadku nie zrealizowania w okresie jej trwania całości przedmiotu umowy. W takim przypadku zmiana umowy wymaga podpisania aneksu, z tym że Zamawiający jednostronnie zawiadamia Wykonawcę o proponowanym przedłużeniu umowy przed upływem terminu na jaki została ona zawarta. 1. Leki różne – 4 pozycje w Części 2. Szczegółowy opis przedmiotu zamówienia, wymagania Zamawiającego określono w Formularzu cenowo – ofertowym – Załączniku nr 1 do SWZ. 3. Zakres zamówienia obejmuje dostawę przedmiotów zamówienia w ilościach wyszczególnionych w Formularzach cenowo – ofertowych na okres: - Część nr 2 – 24 miesięcy 4. Zamawiający nie dopuszcza składania ofert równoważnych. 5. TERMIN WYKONANIA ZAMÓWIENIA: 5.1 Zakup i sukcesywna dostawa przedmiotów zamówienia: Część nr 2 - przez 24 miesiące, licząc od dnia 12.03.2026r. 5.2 W Części nr 2 Zamawiający dopuszcza możliwość wcześniejszego realizowania zakupów w przypadku wyczerpania ilości z aktualnej umowy. W takim przypadku termin realizacji umowy, liczony będzie od momentu pierwszego zakupu danego przedmiotu zamówienia. 5.3 Zamawiający w Części nr 2 dopuszcza możliwość późniejszego rozpoczęcia realizacji umowy, w przypadku przedłużenia się procedury przetargowej. 5.4 Zamawiający w Części nr 2 dopuszcza możliwość zmiany terminu obowiązywania umowy zawartej z Wykonawcą w przypadku nie zrealizowania w okresie jej trwania całości przedmiotu umowy. W takim przypadku zmiana umowy wymaga podpisania aneksu, z tym że Zamawiający jednostronnie zawiadamia Wykonawcę o proponowanym przedłużeniu umowy przed upływem terminu na jaki została ona zawarta. 1. Leki różne – 1 pozycja w Części 2. Szczegółowy opis przedmiotu zamówienia, wymagania Zamawiającego określono w Formularzu cenowo – ofertowym – Załączniku nr 1 do SWZ. 3. Zakres zamówienia obejmuje dostawę przedmiotów zamówienia w ilościach wyszczególnionych w Formularzach cenowo – ofertowych na okres: - Część nr 3 – 24 miesięcy 4. Zamawiający nie dopuszcza składania ofert równoważnych. 5. TERMIN WYKONANIA ZAMÓWIENIA: 5.1 Zakup i sukcesywna dostawa przedmiotów zamówienia: Część nr 3 - przez 24 miesiące, licząc od dnia 12.03.2026r. 5.2 W Części nr 3 Zamawiający dopuszcza możliwość wcześniejszego realizowania zakupów w przypadku wyczerpania ilości z aktualnej umowy. W takim przypadku termin realizacji umowy, liczony będzie od momentu pierwszego zakupu danego przedmiotu zamówienia. 5.3 Zamawiający w Części nr 3 dopuszcza możliwość późniejszego rozpoczęcia realizacji umowy, w przypadku przedłużenia się procedury przetargowej. 5.4 Zamawiający w Części nr 3 dopuszcza możliwość zmiany terminu obowiązywania umowy zawartej z Wykonawcą w przypadku nie zrealizowania w okresie jej trwania całości przedmiotu umowy. W takim przypadku zmiana umowy wymaga podpisania aneksu, z tym że Zamawiający jednostronnie zawiadamia Wykonawcę o proponowanym przedłużeniu umowy przed upływem terminu na jaki została ona zawarta. 1. Leki różne – 1 pozycja w Części 2. S",Uniwersytecki Szpital Kliniczny im. Fryderyka Chopina w Rzeszowie
Czechia – Medical consumables,2026-02-12,CZE,,https://ted.europa.eu/en/notice/-/detail/14967-2026,14967-2026,33140000|33140000,"Předmětem veřejné zakázky jsou průběžné dodávky elektrod defibrilačních endokardiálních, jejichž účelem je přenášení elektrických signálů do srdečního svalu a naopak, implantují se vždy ke kompatibilnímu ICD, určeno výhradně pro I.Interní kliniku - odd. invaz. vyš. metod-kardiovertery, Fakultní nemocnice Olomouc, a to dle popisu a minimálních technických podmínek stanovených v příloze č. 3 zadávací dokumentace.",Fakultní nemocnice Olomouc
Poland – Hospital facilities construction work,2026-01-16,POL,,https://ted.europa.eu/en/notice/-/detail/15048-2026,15048-2026,45215140|71200000|71220000|71221000|71300000|71310000|71320000|42414100|45000000|45110000|45111200|45210000|45215100|44211100|45220000|45422000|45300000|45310000|45315000|45311200|45315700|45312000|45312100|45314300|45314310|45315300|45320000|45321000|45323000|45330000|45331000|45331100|45331200|45332000|45332400|45333000|45400000|45410000|45421000|45421100|45430000|45440000|45450000|42416100|39150000|33100000|45215140|71200000|71220000|71221000|71300000|71310000|71320000|42414100|45000000|45110000|45111200|45210000|45215100|44211100|45220000|45422000|45300000|45310000|45315000|45311200|45315700|45312000|45312100|45314300|45314310|45315300|45320000|45321000|45323000|45330000|45331000|45331100|45331200|45332000|45332400|45333000|45400000|45410000|45421000|45421100|45430000|45440000|45450000|42416100|39150000|33100000,"numeracja zgodna z SWZ: Dokumenty na wezwanie Zamawiającego potwierdzające spełnianie warunków udziału w postępowaniu: 8.1.4. dotyczące zdolności technicznej lub zawodowej  Wykaz robót budowlanych – zgodnie z punktem 6.1.2.4.1 SWZ oraz Załącznikiem nr 5 do SWZ. NA WEZWANIE Zamawiającego (zgodnie z punktem 8.4 SWZ).  Wykaz osób – zgodnie z punktem 6.1.2.4.2 SWZ oraz Załącznikiem nr 6 do SWZ. NA WEZWANIE Zamawiającego (zgodnie z punktem 8.4 SWZ) Okresy wyrażone w latach lub miesiącach liczy się wstecz od dnia, w którym upływa termin składania ofert. Jeżeli wykonawca powołuje się na doświadczenie w realizacji robót budowlanych wykonywanych wspólnie z innymi wykonawcami, wykaz o którym mowa wyżej, dotyczy robót budowlanych, w których wykonawca ten bezpośrednio uczestniczył. UZASADNIENIE PODANIA TERMINU REALIZACJI DATĄ: Zamawiający określił termin realizacji Inwestycji poprzez wskazanie konkretnej daty kalendarzowej (sztywnej), a nie jako przedział czasu liczony od daty zawarcia umowy. Powyższe rozwiązanie znajduje oparcie w art. 436 pkt 1 ustawy Prawo zamówień publicznych i jest podyktowane następującymi obiektywnymi przyczynami: 1. Rygorystyczne ramy czasowe finansowania ze środków KPO (Inwestycja D1.1.1) Zamówienie jest współfinansowane ze środków Krajowego Planu Odbudowy i Zwiększania Odporności. Umowa o objęcie wsparciem nr KPOD.07.02-IP.10-0248/24/KPO/498/2025/192 narzuca na Zamawiającego sztywny, nieprzekraczalny termin zakończenia realizacji rzeczowej i finansowej przedsięwzięcia. Okres kwalifikowalności wydatków w ramach KPO jest ściśle ograniczony datami kalendarzowymi. Określenie terminu w formule „X miesięcy od podpisania umowy” stwarzałoby ryzyko, że w przypadku przedłużającej się procedury przetargowej, termin zakończenia wykroczyłby poza okres kwalifikowalności, co skutkowałoby utratą dofinansowania i naruszeniem dyscypliny finansów publicznych. Sztywna data końcowa przenosi ryzyko czasu trwania procedury na etap ofertowania (Wykonawca musi uwzględnić krótszy czas na realizację w przypadku późniejszego podpisania umowy). 2. Nierozerwalna całość techniczno-organizacyjna i logistyczna. Inwestycja realizowana jest na czynnym obiekcie szpitalnym („na żywym organizmie”) opartym na wspólnej architekturze, wspólnych ciągach komunikacyjnych i instalacjach krytycznych, prace w jednej części maja bezpośredni wpływ na wszystkie pozostałe – wymagane jest koordynacja i synchronizacja wszystkich prowadzonych prac. • Przykład: Zakończenie nadbudowy Urologii (Etap 1) w konkretnej dacie jest warunkiem koniecznym do zwolnienia pomieszczeń na parterze, co z kolei jest warunkiem niezbędnym do przeniesienia i powiększenia oddziału Onkologii Klinicznej (a co za tym idzie uzyskania wskaźników rezultatu wynikających z wymagań podpisanej umowy o dofinasowanie). • Przesunięcie któregokolwiek terminu o nieokreśloną liczbę dni (wynikającą z daty podpisu umowy) zdestabilizowałoby harmonogram pracy medycznej szpitala, uniemożliwiając planowanie przyjęć pacjentów, zabiegów operacyjnych oraz kontraktowanie świadczeń z NFZ. Szpital musi znać dokładną datę dostępności nowej infrastruktury, aby z wielomiesięcznym wyprzedzeniem planować ciągłość leczenia. 3. Koordynacja dostaw wyposażenia: W ramach zamówienia realizowane są dostawy wysokospecjalistycznej aparatury medycznej (np. kolumny chirurgiczne, myjnie, aparaty USG,). Producenci tego typu sprzętu wymagają precyzyjnego harmonogramu dostaw i instalacji. Sztywna data zakończenia robót budowlanych (uzyskania gotowości instalacyjnej) jest niezbędna do skoordynowania procesów produkcyjnych i logistycznych dostawców zewnętrznych, tak aby uniknąć kosztów magazynowania drogiego sprzętu lub opóźnień w jego instalacji. Podsumowanie: Zastosowanie sztywnej daty realizacji jest jedynym środkiem gwarantującym, że cel inwestycji zostanie osiągnięty w terminach wymaganych przez Instytucję Finansującą (KPO) oraz w sposób zapewniający bezpieczeństwo zdrowotne pacjentów (ciągłość pracy szpitala). Wykonawcy składają",Wielospecjalistyczny Szpital - Samodzielny Publiczny Zespół Opieki Zdrowotnej w Zgorzelcu
Norway – Patient-monitoring system,,NOR,,https://ted.europa.eu/en/notice/-/detail/15091-2026,15091-2026,33195000|48180000|48814100|48814400|33195000|48180000|48814100|48814400,Helse Nord RHF would like to enter into a regional agreement for the procurement of an electronic patient monitoring system with notification and check list for nursing personnel. The system must ensure patient safety and efficient work flow connected to the registration of vital patient data. Herein a functionality that safeguards the offline mode and which gives nursing personnel reduced manual and duplicate activity in connection with registration of the electronic curve and medication. The need shall be taken care of via a mobile application with integration possibilities with the electronic patient journal system (EPJ) which is Dips.,SYKEHUSINNKJØP HF
France – Surgical implants,2026-02-09,FRA,,https://ted.europa.eu/en/notice/-/detail/15281-2026,15281-2026,33184100|33184100|33184100,"Lots 1 à 54 : du 01/08/2026 (ou de sa date de notification au titulaire, si celle-ci est postérieure) au 28/02/2029. Lots 55 à 80 : du 01/08/2026 (ou de sa date de notification au titulaire, si celle-ci est postérieure) au 30/11/2029.",Centre Hospitalier de Douai
Croatia – Dressings,2026-02-13,HRV,,https://ted.europa.eu/en/notice/-/detail/15330-2026,15330-2026,33141110|33141110,,Klinički bolnički centar Zagreb
Czechia – Diagnostic kits,2026-01-16,CZE,,https://ted.europa.eu/en/notice/-/detail/15515-2026,15515-2026,33141625|38434000|33696500|33141625|38434000|33696500,"Předmětem plnění veřejné zakázky jsou: a) opakované dodávky originálních diagnostik, tj. reagencií, kalibrátorů, kontrolních materiálů, provozních chemikálií a veškerého spotřebního materiálu (dále jen „diagnostika“), k materiálnímu zajištění koagulačních, chromogenních, imunochemických a agregačních metod v hematologické laboratoři, jejichž výčet je uveden v příloze č. 2 zadávací dokumentace; a b) bezplatné vypůjčení a instalace dvou vysokokapacitních plně automatických koagulometrů (dále jen „analyzátorů“), včetně příslušenství a SW, školení, jejich plného servisu vč. bezpečnostně technických kontrol dle návodu výrobce ev. validací a případné modernizace po celou dobu plnění veřejné zakázky.",Fakultní nemocnice Královské Vinohrady
Czechia – Cardiac valve,2026-02-13,CZE,,https://ted.europa.eu/en/notice/-/detail/15713-2026,15713-2026,33182220|33182220,"Předmětem této veřejné zakázky jsou opakované dodávky speciálního zdravotnického materiálu ve smyslu ustanovení § 2 zákona č. 89/2021 Sb., o zdravotnických prostředcích a o změně některých souvisejících zákonů, ve znění pozdějších předpisů, a to transkatetrové balonexpandibilní chlopně (TAVI) s alternativním přístupem a s úpravou redukující ukládání kalcia potřebných k léčbě pacientů na pracovišti zadavatele.",Institut klinické a experimentální medicíny
Estonia – Disposable non-chemical medical consumables and haematological consumables,2026-02-09,EST,,https://ted.europa.eu/en/notice/-/detail/15908-2026,15908-2026,33141000|33196000|33141000|33196000,Silma süstimise abivahendite ostmine vastavalt hankedokumentides ja hanketeates sätestatule / Kõrvaldamise alused ja kvalifitseerimistingimused: Vaata hanke alusdokumentidest,Aktsiaselts Ida-Tallinna Keskhaigla
