title,deadline,country,estimated_value_eur,tender_url,notice_id,cpv_codes,description,buyer_name
Mental Health Recovery,2028-05-08,GBR,20000000,https://www.contractsfinder.service.gov.uk/Notice/Notice/Details/c6c43253-15a2-4aba-82e0-4dfa0aae377d,20230127170949-104118,85000000 85100000 85140000 85323000 85300000 85310000 85311000 85312000 85320000 98000000,"The Council is seeking applications from experienced providers with the capability and capacity to deliver community mental health care and support in Rotherham.  

A review of current mental health care and support provision in Rotherham indicates the need to improve the community service model to one which offers mental health recovery support personalised social care, with increased choice and control for people living with mental ill-health.  

This new care and support model has been co-produced in partnership with people accessing services and their supporting professionals to inform the service design. 
Such services will support people to achieve independent living skills, move towards, and sustain, independent living in the communities in which they live. 

Aiming to harness the opportunities which exist in the wider care and support market, this Mental Health Recovery Flexible Purchasing System (FPS) will increase choice and improve outcomes for people living with mental ill-health in Rotherham.  

Applicants can read the Cabinet Paper dated 17th October 2022 Commissioning Mental Health Recovery Focused Community Services - Rotherham Council which sought the approval for the procurement process to establish this FPS and procure a range of community services which reflect the principles of mental health recovery model. 

The FPS will comprise of a number of separate Lots.  Each Lot will specify a community service (i.e., supported living accommodation-based services, day opportunities) with the principle of mental health recovery at its core. 

The contract end date specified is provided as an indication only , the system can continue beyond the 5 years as per the rules and subject to cabinet approval.

Applicants are advised that the indicative spend activity to be generated via the system is in the region of &#xA3;4m per annum, there is no new funding for developing the initiatives proposed. The cost associated with this Flexible Purchasing System will be met within existing budgets currently set at &#xA3;5.7m (2022-2023).  

Applicants are required to register with the Social Value Portal and commit to delivering Social Value additionality via all contracts awarded via the system.

Full details regarding the application process are contained within the application documentation which can be downloaded free of charge via YORtender and by searching for project ID 60316",Rotherham Metropolitan Borough Council
Adults with Disabilities Pseudo-DPS,2033-03-26,GBR,500000000,https://www.contractsfinder.service.gov.uk/Notice/Notice/Details/738b1dab-d904-4763-997a-ee6f6a8d4cbe,20221130150155-104130,85000000 85100000,"*Actual contract start and end dates are the 27th March 2023 and end date 26th March 2033*

This Dynamic Purchasing System (DPS) is for people who live within the Sheffield boundary, who are of Working Age (aged 16 or over), and who have disabilities, and/or long-term health conditions. It will enable people to obtain support within the home and/or activities and support outside the home.",EU SUPPLY LIMITED
SEND Independent School Placements - DPS,2027-09-21,GBR,36000000,https://www.contractsfinder.service.gov.uk/Notice/Notice/Details/24704c1d-aa7e-4b85-bd15-efd5b73f8054,IT-480-224-CYP0006,85000000,The SEND Placements DPS (Dynamic Purchasing System) will enable the Council to secure the appropriate provision where it is established that a child or young person should be placed with an independent or non-maintained special school.,Milton Keynes Council
Shropshire and Telford &amp; Wrekin VCSE Mental Health Transformation,2026-11-08,GBR,1,https://www.contractsfinder.service.gov.uk/Notice/Notice/Details/44894d9f-2289-40fd-9a81-fec7b5f4a77f,20221109130350-67601,85000000,"Shropshire and Telford &amp; Wrekin VCSE Mental Health Transformation

PLEASE NOTE : THE CONTRACT START DATE WILL COMMENCE ON 9th NOVEMBER 2022 AND EXPIRE ON 9th NOVEMBER 2026.",Midlands Partnership Foundation Trust
WSCC GM Framework Reopening for the provision of Accommodation and Support for 16+ Older Looked After Young People and Care Leavers,2026-08-29,GBR,44000000,https://www.contractsfinder.service.gov.uk/Notice/Notice/Details/1f1a98ca-1616-4806-8985-4a6319ac4aaf,IT-234-33889-CWSCC - 033889,85000000 85311000,"A Framework for the provision of Accommodation and Support for 16+ Older Looked After Young People and Care Leavers, was established and effective from 1st September 2021 by West Sussex County Council. 
      
      From January 2022, the Framework will be continually open to new Service Providers to join the Framework at any time throughout the Agreement Term.",West Sussex County Council
LPS CARE - Pseudo Dynamic Purchasing System for the Provision of Childrens Home Services - RFQ 15315336,2032-07-29,GBR,530000000,https://www.contractsfinder.service.gov.uk/Notice/Notice/Details/4318df33-7ce6-4c0f-87a9-2a2e834d606d,KS/CYP/LCC/21/1208,85000000,"&quot;Lancashire County Council (the Council) wishes to establish a Pseudo Dynamic Purchasing System (PDPS) which is a list of Children&#039;s Home Services providers who are suitable, and capable to deliver the required services. 

All children&#039;s homes on the PDPS must be within the Location Boundary and applicants will be required to meet the stated criteria to join the PDPS. Please see the procurement documents for further details. 

It is intended that the PDPS will remain effect for a period of ten years. Service Contracts can be awarded as call-off contracts as detailed within the Invitation to Participate (ITP).
The PDPS may be used by the Contracting Authority listed below and any successor council as defined in The Local Government (Structural Changes) (Transfer of Functions, Property, Rights and Liabilities) Regulations 2008 to the Contracting Authorities.
•	Blackpool Council 


How to Apply
All procurement documents including the Invitation to Participate (ITP) document can be found on following webpage: https://www.lancashire.gov.uk/business/tenders-and-procurement/tenders/pseudo-dynamic-purchasing-system-pdps-for-the-provision-of-childrens-home-services/
Please see the procurement documents for further information in relation to the instructions on how to apply to join the PDPS, evaluation criteria, terms and conditions and documents to be returned.
The PDPS will be open for new applications until the Initial application deadline. Once the initial application deadline has passed, the Council will evaluate future applications at specified times. Please see the Invitation to Participate (ITP) document for further detail in relation to the initial application deadline and future evaluation periods.  

Value:
The estimated values for the PDPS allow for cost increases during the term. 
The estimated annual value for placements made by Lancashire County Council is &#xA3;35,000,000 - &#xA3;45,000,000 depending on demand. 
The estimated annual value for placements made by Blackpool Council is &#xA3;18,000,000 - &#xA3;22,000,000 depending on demand.

The estimated total Annual Value is up to &#xA3;53,000,000 - &#xA3;67,000,000

The estimated Total Value is up to &#xA3;530,000,000 - &#xA3;670,000,000&quot;

If you cannot access the LCC webpage which includes the procurement documents using the link provided, try using the following steps to locate the LCC webpage for this procurement:
1.	Access the Lancashire County Council website at: www.lancashire.gov.uk
2.	Select the &#039;Business&#039; Link
3.	Select the &#039;Tenders and Procurement&#039; Link
4.	Select the &#039;View tender opportunities&#039; Link
5.	Select the Link for &#039; Pseudo Dynamic Purchasing System (PDPS) for the provision of Childrens Home Services - RFQ 15315336&#039;",Lancashire County Council
Leicestershire Children and Families Services Gateway2Resources (G2R) - Supported Accommodation for Young People Aged 16+,2030-11-30,GBR,166000000,https://www.contractsfinder.service.gov.uk/Notice/Notice/Details/11ea66e5-14a6-4814-b274-267a018d73c6,LEICSCC001-DN492655-86511343,85000000,"Please Note: This DPS is not suitable for Supported Living (as defined by CQC) providers or Domiciliary Care providers.

Leicestershire County Council (the Council) is conducting a procurement to establish a Dynamic Purchasing System (DPS) in accordance with the requirements of the Public Contracts Regulations 2015 (SI 2015/102) (PCR 2015). 

The Council is inviting suitably experienced and qualified Providers to submit tenders to apply to join the Leicestershire Children and Families Services Gateway2Resources (G2R) Dynamic Purchasing System (DPS) to provide accommodation and support by supplying Supported Accommodation placements and support to Leicestershire&#039;s Looked After Children (LAC), Care Leavers, Unaccompanied Asylum Seeking Children (UASC) and Young People (at risk of homelessness) not owed a social care duty between the ages of 16-18. 

The Council wishes to work collaboratively with Providers to ensure that placement requirements for Leicestershire&#039;s LAC cohort can meet demand and need. We are requesting that providers apply to join the DPS and work with the Council&#039;s vision to ensure that Leicestershire young people can live locally and are offered high quality, value for money placements. The DPS will consist of two categories; Supported Shared Accommodation for young people aged 16+, and; Independent Accommodation with Floating Support for young people aged 16+
",Leicestershire County Council
KMCAS-125 - Electronic Market Place for Supported Living Services,2032-03-31,GBR,70000000,https://www.contractsfinder.service.gov.uk/Notice/Notice/Details/d26cb948-a4f2-46a5-a187-2a8ed962276a,20220202170105-104104,85000000,"The Council of the Borough of Kirklees (the &quot;Council&quot;) is conducting this procurement exercise, in accordance with the Light Touch Regime of the Public Contracts Regulations 2015 (SI 2015/102), and intends to establish an Electronic Market Place (&quot;EMP&quot;) with Providers with relevant experience and ability to provide Supported Living Services on a non-exclusive basis to Adults with eligible Social Care needs for the Council. 

The Council wishes to establish a Supported Living Services (SLS) EMP  to replace the current Framework Agreement.  As the current Framework Agreement does not allow new Providers to be able to join, the new SLS EMP will  allow new Providers to join. 

A  SLS EMP will be established and will allow the Council to engage with suitably qualified Providers who will be able to deliver flexible services which will empower Service Users to live as independently as possible in their own home; this may include 1:1 support to access community activities and social activities.  

*Please note, this EMP is anticipated to run from 1st April 2022 to 31st March 2027 with the Council reserving the right to extend for up to five (5) further twelve (12) month periods up to 31st March 2032*

The value of the Services to be awarded through this EMP is estimated to be approximately &#xA3;7,000,000.00 (seven million pounds) per annum, with an estimated total value of &#xA3;35,000,000.00 (thirty five million pounds) for the initial EMP period of 1st April 2022 to 31st March 2027.

Tender documents are available to download at: https://www.yortender.eu-supply.com.",Kirklees Council
LPS CARE - Flexible Agreement for the provision of Fostering Agency Placements - RFQ 15314114,2031-05-04,GBR,375000000,https://www.contractsfinder.service.gov.uk/Notice/Notice/Details/ff2ce3fc-0e8e-4c2f-b5c4-d05620f8e029,KH CYP/LCC/22/717,85000000,"Contract Finder: 
Lancashire County Council (the Council) are leading on the procurement of an open Flexible Agreement for the Provision of Fostering Agency Placements. The Flexible Agreement will be a list of approved Independent Foster Care Providers. Providers can apply to join the Flexible Agreement, if Applicants satisfies the required criteria. The Flexible Agreement will be open for new Applications during this initial Application phase. Once the initial Application deadline has passed (see ITP for dates), Providers can apply to join every three years throughout the term. Following an evaluation process, applicants will receive an outcome notification.  Successful Applicants will be required to sign a Flexible Agreement and will be appointed as a provider.
This Flexible Agreement will be used by the Lancashire County Council and Contracting Authorities listed below and identified in the contract notice and any successor council as defined in The Local Government (Structural Changes) (Transfer of Functions, Property, Rights and Liabilities) Regulations 2008 to the Contracting Authorities.

•	Cumbria County Council 
•	Blackpool Council 
•	Blackburn with Darwen Council 
All instructions on how to participate and apply to join the Flexible Agreement, evaluation criteria, terms and conditions and documents to be returned can be found on following webpage: https://www.lancashire.gov.uk/business/tenders-and-procurement/tenders/flexible-agreement-for-the-provision-of-fostering-agency-placements/",Lancashire County Council
P0834 -1  Mentoring and Positive Activity Services - DPS,2026-12-05,GBR,,https://www.contractsfinder.service.gov.uk/Notice/Notice/Details/55051aed-5c07-4ca0-a5a1-0df6bd90e67b,IT-100-3544-P0834-1,85300000 85000000 98000000 80570000 75200000 80510000,"The Trust wishes to establish a Dynamic Purchasing system (DPS) for the Provision of Mentoring Services in accordance with Regulation 34 of the Public Contracts Regulations 2015 (PCR 2015), the Public Procurement (Amendments, Repeals and Revocations) Regulations 2016 and in accordance with the Light Touch Regime as set out in Schedule 3 of the Public Contracts Regulations 2015 (Annex A) (PCR 2015) in relation to Social, Health and Education services. The publication of this document in no way commits Birmingham City Council or THE TRUST to award any contract pursuant to any procurement process.
      
      The DPS will be for the delivery of mentoring and positive activity services for Young Offenders and those at risk of offending, and will be established using the following category basis:
      
      o SEN Specialist support / provision eg. for young people with SEMH, ASC needs
      o Gang Specialist Mentoring 
      o Preventing Serious Youth Violence
      o Anti-knife crime programmes 
      o Anger Management 
      o Therapeutic Interventions (PTSD, trauma informed interventions, CBT, Green space initiatives, Art Based therapies)
      o Motivational, Resilience and Stamina building interventions / workshops 
      o Positive Diversionary activities 
      o Raising Aspirations initiatives
      o Routeway into employment initiatives 
      o Supported Work experience / Experience of the workplace Tasters
      o Career Sector training and Accreditation offer
      o Entrepreneurial initiatives  
      o Supporting engagement into Education, Training and Employment 
      o Journey support offer to support access to Education, Training and Employment
      o Life skills and developmental skills activity  
      o Addressing disproportionality issues
      o Preventing Violent Extremism initiatives 
      o Victim support initiatives
      o Restorative Justice Interventions
      o Mentoring support for Eastern European Romany cohort
      
      The DPS will last for an initial period of 5 years, commencing on 6th December 2021, with the option to extend for up to 3 additional years subject to satisfactory performance and funding.
      
      The DPS is a two-stage process:
      Stage 1 - Providers wishing to join the DPS shall complete a set of Specific Questions (SQ) that are standard for all Providers. Provider&#039;s SQ submissions are evaluated on a pass / fail basis to establish the Providers general capability to undertake the work tendered for. 
      Stage 2 - The Youth Offending Service shall utilise this DPS for any call off procedures, this includes the option for the Service to specify their individual requirements and to vary the award criteria.
      
      There are two ways of making a call off from this arrangement as detailed immediately below:-
      o Direct Award
      o Mini Competition
      
      Birmingham Children&#039;s Trust will be using its e-tendering system (in-tend) for the administration of this procurement process and providers must register with the system to be able to express an interest. The web address i...",Birmingham City Council
Children and Young People Continuing Healthcare,2026-10-31,GBR,1,https://www.contractsfinder.service.gov.uk/Notice/Notice/Details/04c7b797-5b6f-4d0d-afc5-629b72b91091,20210806173042-68205,85100000,"The service covers care in Norfolk and Waveney and will be provided for children and young people (Service Users) who have been determined as having a Continuing Care need.
The provider will ensure that the services can be provided 365 days per year, 24 hours a day, in accordance with the service Specification and Service User&#039;s Care Plan.
The Preferred Provider List is awarded on a zero value, zero volume basis and the contract awarded will be for a period of 3 years.

The contract dates (01st November 2024 - 02nd November 2024) in the contract start and end &quot;dates&quot; fields are incorrect. The contract length will be from the point of award until the expiration date of the contract (31st October 2024). The contract for the initial window will commence 1st November 2021.
Applications throughout the life of the agreement and contracts will be awarded during the life of the contract if providers are successful. Please see Document 11 of the AQP documentation within the attachments area of the project on EU-Supply for full details of the Application Windows and process.

To access the documentation please visit EU-Supply on the link below and access project Quote/tender  45608 - NW064CYP - Children and Young People Continuing Healthcare. https://uk.eu-supply.com/app/rfq/rwlentrance_s.asp?PID=39095&amp;B=AGCSU",NHS Arden and Greater East Midlands Commissioning Support Unit
"Provision of a Provider List for Day Time Support Service for Older People and People with Dementia - RFQ 15199149,2",2028-06-27,GBR,17330000,https://www.contractsfinder.service.gov.uk/Notice/Notice/Details/9b3cd0f9-9cb0-4cdd-9c02-46af2830063a,KH/ACS/LCC/17/576. (Updated June 2020),85000000,"The Authority is inviting suitably experience Service Providers to apply for their Day Time Support service(s) to be included on the Authority&#039;s Provider List of Day Time Support Services for Older People and People with Dementia. The List has been open from 1st July 2018 and will remain open for a maximum of 10 years (unless terminated early). 

To gain a place on the Provider List, Service Provider will need to satisfy the selection requirements, have no grounds for exclusion and confirm they meet and will maintain the Minimum Quality Standards throughout the period of validity to be added to the Provider List.

The Provider List does not provide any guarantee of business to any individual Service Provider. Now the Provider List has commenced, any Service User can access the Provider List and choose which daytime support they wish to attend from the Authority&#039;s website. Referrals can be made directly by the Service User, family and carers or via a social worker and the Authority&#039;s Care Navigation Service.

An engagement event focusing on the future of older people&#039;s daytime support took place o 12th June 2017

The Provider List is be open for 10 years and Service Providers are invited to submit an application at anytime from 1st June 2018 using RFQ number 15199149. Please see link below to access the tender documents, where you will also see timescales for evaluation.",Lancashire County Council
Cambridgeshire County Council Day Opportunities for Adults with a Learning Disability,2028-04-30,GBR,40000000,https://www.contractsfinder.service.gov.uk/Notice/Notice/Details/77ca5114-613c-4f70-8d77-9290cacb1d24,LGSS001-DN312349-71409684,85000000,"The next round of this framework has been delayed due to the Council Covid19 response.
Cambridgeshire County Council has set up an Open Framework under the &#039;Light Touch&#039; provisions of the Public Contracts Regulations (Chapter 3, Section 7 - Social and Other Specific Services). The Open Framework commenced on 01/05/18 and is for a period of 10 years. The Framework will re-open periodically for new and previously unsuccessful providers to apply. The closing date of the current opportunity to apply will be determined at a later date.
The Open Framework is for day opportunities for adults with a learning disability.
Providers must recognise the role they play in ensuring that people with learning disabilities experience the good health and well-being necessary to live a meaningful life. The Council is trying to move towards a model that helps people to live as independently as possible at all levels of need, so the focus is on progression.
Peterborough City Council may call-off this framework for service users they have assessed as eligible using their own criteria.
",Cambridgeshire County Council
Cambridgeshire County Council Residential Services for Adults with a Learning Disability,2028-04-28,GBR,224000000,https://www.contractsfinder.service.gov.uk/Notice/Notice/Details/9599850d-7536-4764-abd3-0c536a9c0548,LGSS001-DN312327-36091997,85000000,"The next round of this framework has been delayed due to the Council&#039;s Covid-19 response.                                                Cambridgeshire County Council is commissioning Residential Services for Adults with a Learning Disability, setting up an Open Framework for a period of 10 years. This means that the Framework will re-open at intervals to allow for new and previously unsuccessful providers to apply to join. Providers must recognise the role they play in ensuring that people with learning disabilities experience the good health and wellbeing necessary to live a meaningful life. Providers should be aware that there are higher incidences of long term conditions, and other health problems, experienced by people with learning disabilities and prioritises preventative and palliative services and support to minimise potential impacts to service users. As such staff must have sufficient and appropriate training and skills to effectively engage people with learning disabilities in health promotion. The Council is trying to move towards a model that helps people to live as independently as possible at all levels of need, so the focus is on progression. Peterborough City Council may call-off this Framework for service users they have assessed as eligible using their own criteria.",Cambridgeshire County Council
Cambridgeshire Residential and Nursing Framework,2030-03-31,GBR,555000000,https://www.contractsfinder.service.gov.uk/Notice/Notice/Details/1ba72a11-1508-47ed-9b14-660e50c4548a,LGSS001-DN455833-24277370,85000000,"Cambridgeshire County Council is putting in place a Framework for the provision of residential, residential dementia, nursing and nursing dementia care. The Framework will be open for applications throughout its duration and the Authority intends to evaluate applications approximately every 6 months, but reserves the right to evaluate more or less frequently. The Framework duration is 10 years, from 01/04/2020 to 31/03/2030. The current round of framework applications will close on the 20th March 2020 at 12:00.
Any Public Body outlined in either Part I or Part II of the Local Authorities (Goods and Services) (Public Bodies) Order 1972 may call off this Framework. Details of these can be found at http://www.legislation.gov.uk/uksi/1972/853/made",Cambridgeshire County Council
Cambridgeshire County Council Supported Living Services for Adults with a Learning Disability,2028-04-30,GBR,226000000,https://www.contractsfinder.service.gov.uk/Notice/Notice/Details/ec1d2119-eb6a-45d7-9d68-cb55bab0ce76,LGSS001-DN311905-17874664,85000000,"Cambridgeshire County Council has set up an Open Framework for Supported Living Services with Adults with a Learning Disability for a period of 10 years. This means that the Framework will re-open at intervals to allow for new and previously unsuccessful providers to apply to join. There are two Lots - 1) Standard, and 2) Complex Needs. 
IMPORTANT: Applications for this round will close at 12:00 on the 4th September 2019. 
Providers must recognise the role they play in ensuring that people with learning disabilities experience the good health and wellbeing necessary to live a meaningful life. Providers should be aware that there are higher incidences of long term conditions, and other health problems, experienced by people with learning disabilities and prioritises preventative and palliative services and support to minimise potential impacts to service users. As such staff must have sufficient and appropriate training and skills to effectively engage people with learning disabilities in health promotion. The Council is trying to move towards a model that helps people to live as independently as possible at all levels of need, so the focus is on progression.
Peterborough City Council may call-off this Framework for service users they have assessed as eligible using their own criteria",Cambridgeshire County Council
